{"$schema":"https://json-schema.org/draft/2020-12/schema","title":"naruto.timeline.v1","type":"object","required":["schema_version","dataset","calendar","shard","records","unresolved"],"additionalProperties":false,"properties":{"$schema":{"type":"string"},"schema_version":{"const":"naruto.timeline.v1"},"dataset":{"const":"naruto-manga-databook"},"calendar":{"type":"object","required":["id","months_per_year","days_per_month"],"properties":{"id":{"const":"konoha-360-v1"},"months_per_year":{"const":12},"days_per_month":{"const":30}},"additionalProperties":false},"shard":{"type":"object"},"records":{"type":"array","items":{"$ref":"#/$defs/event"}},"unresolved":{"type":"array"}},"$defs":{"date":{"type":"string","pattern":"^K[0-9]{3}-(0[1-9]|1[0-2])-([0-2][1-9]|10|20|30)$"},"event":{"type":"object","required":["id","title","aliases","continuity","arc_id","parent_event_id","when","summary","facts","participants","location_ids","depends_on","applicability","canonical_outcomes","knowledge","retrieval","source_refs","qa"],"properties":{"id":{"pattern":"^EV-[A-Z0-9-]+-[0-9]{4}$"},"title":{"type":"string"},"aliases":{"type":"array"},"continuity":{"const":"manga_canon"},"arc_id":{"type":"string"},"parent_event_id":{"type":["string","null"]},"when":{"type":"object","required":["scheduled_start","scheduled_end","time_of_day","day_order","basis","source_precision","canon_window","confidence","anchor_event_ids","rationale"],"properties":{"scheduled_start":{"$ref":"#/$defs/date"},"scheduled_end":{"$ref":"#/$defs/date"},"time_of_day":{"enum":["dawn","morning","noon","afternoon","evening","night","late_night","unknown"]},"day_order":{"type":"integer"},"basis":{"enum":["explicit","calculated","allocated"]},"source_precision":{"enum":["exact_day","month_day","month_only","year_only","relative","sequence_only"]},"canon_window":{"type":"object"},"confidence":{"enum":["high","medium","low"]},"anchor_event_ids":{"type":"array"},"rationale":{"type":"string"}},"additionalProperties":false},"summary":{"type":"string"},"facts":{"type":"array"},"participants":{"type":"array"},"location_ids":{"type":"array"},"depends_on":{"type":"array"},"applicability":{"type":"object"},"canonical_outcomes":{"type":"array"},"knowledge":{"type":"object"},"retrieval":{"type":"object"},"source_refs":{"type":"array","minItems":1},"qa":{"type":"object"}},"additionalProperties":false}}}
