{
  "$schema": "../../../schemas/timeline-event.schema.json",
  "schema_version": "naruto.timeline.v1",
  "dataset": "naruto-manga-databook",
  "calendar": {
    "id": "konoha-360-v1",
    "months_per_year": 12,
    "days_per_month": 30
  },
  "shard": {
    "id": "TL-NAR-GAIDEN-AUTO",
    "arc_id": "ARC-NAR-GAIDEN",
    "part": 1,
    "id_start": 1,
    "id_end": 60,
    "date_start": "K050-06-01",
    "date_end": "K050-06-05",
    "source_coverage": [
      {
        "type": "manga",
        "work": "NARUTO",
        "chapter_start": 239,
        "chapter_end": 244
      }
    ]
  },
  "records": [
    {
      "id": "EV-NAR-GAIDEN-0001",
      "title": "卡卡西外传·剧情节拍001",
      "aliases": [
        "Kakashi Gaiden"
      ],
      "continuity": "manga_canon",
      "arc_id": "ARC-NAR-GAIDEN",
      "parent_event_id": null,
      "when": {
        "scheduled_start": "K050-06-01",
        "scheduled_end": "K050-06-01",
        "time_of_day": "dawn",
        "day_order": 600010,
        "basis": "allocated",
        "source_precision": "sequence_only",
        "canon_window": {
          "earliest": "K050-06-01",
          "latest": "K050-06-05"
        },
        "confidence": "low",
        "anchor_event_ids": [],
        "rationale": "依据NARUTO漫画第239-244章篇章顺序，在项目窗口内均匀分配；具体日不是原著明示。"
      },
      "summary": "第三次忍界大战中，在一次听取新任务的班会上，卡卡西因晋升上忍收到了水门赠送的飞雷神苦无和琳赠送的医疗包。",
      "facts": [
        "第三次忍界大战中，在一次听取新任务的班会上，卡卡西因晋升上忍收到了水门赠送的飞雷神苦无和琳赠送的医疗包。"
      ],
      "participants": [],
      "location_ids": [],
      "depends_on": [],
      "applicability": {
        "required": [],
        "blockers": [],
        "ai_instruction": "根据当前存档裁定发生、改写、跳过或延期。"
      },
      "canonical_outcomes": [],
      "knowledge": {
        "public_at_time": [],
        "restricted_at_time": [],
        "hidden_truth": []
      },
      "retrieval": {
        "keys": [
          "卡卡西外传",
          "Kakashi Gaiden"
        ],
        "tags": [
          "manga_canon",
          "nar-gaiden",
          "zh-reviewed"
        ],
        "spoiler_level": 2
      },
      "source_refs": [
        {
          "type": "manga",
          "work": "NARUTO",
          "chapter_start": 239,
          "chapter_end": 244,
          "pages": null,
          "supports": [
            "sequence",
            "summary"
          ],
          "note": "资料定位页：https://naruto.fandom.com/wiki/Kakashi_Gaiden"
        }
      ],
      "qa": {
        "status": "draft",
        "generated_batch": "TL-NAR-GAIDEN-AUTO",
        "reviewed_by": "manual-translation-NAR-GAIDEN-BATCH-001"
      }
    },
    {
      "id": "EV-NAR-GAIDEN-0002",
      "title": "卡卡西外传·剧情节拍002",
      "aliases": [
        "Kakashi Gaiden"
      ],
      "continuity": "manga_canon",
      "arc_id": "ARC-NAR-GAIDEN",
      "parent_event_id": null,
      "when": {
        "scheduled_start": "K050-06-01",
        "scheduled_end": "K050-06-01",
        "time_of_day": "morning",
        "day_order": 600020,
        "basis": "allocated",
        "source_precision": "sequence_only",
        "canon_window": {
          "earliest": "K050-06-01",
          "latest": "K050-06-05"
        },
        "confidence": "low",
        "anchor_event_ids": [
          "EV-NAR-GAIDEN-0001"
        ],
        "rationale": "依据NARUTO漫画第239-244章篇章顺序，在项目窗口内均匀分配；具体日不是原著明示。"
      },
      "summary": "他的另一位队友带土不仅迟到了（据说是帮一位老奶奶），还忘了带礼物；当卡卡西说他无论送什么都没用时，带土被惹恼了。",
      "facts": [
        "他的另一位队友带土不仅迟到了（据说是帮一位老奶奶），还忘了带礼物；当卡卡西说他无论送什么都没用时，带土被惹恼了。"
      ],
      "participants": [],
      "location_ids": [],
      "depends_on": [
        "EV-NAR-GAIDEN-0001"
      ],
      "applicability": {
        "required": [],
        "blockers": [],
        "ai_instruction": "根据当前存档裁定发生、改写、跳过或延期。"
      },
      "canonical_outcomes": [],
      "knowledge": {
        "public_at_time": [],
        "restricted_at_time": [],
        "hidden_truth": []
      },
      "retrieval": {
        "keys": [
          "卡卡西外传",
          "Kakashi Gaiden"
        ],
        "tags": [
          "manga_canon",
          "nar-gaiden",
          "zh-reviewed"
        ],
        "spoiler_level": 2
      },
      "source_refs": [
        {
          "type": "manga",
          "work": "NARUTO",
          "chapter_start": 239,
          "chapter_end": 244,
          "pages": null,
          "supports": [
            "sequence",
            "summary"
          ],
          "note": "资料定位页：https://naruto.fandom.com/wiki/Kakashi_Gaiden"
        }
      ],
      "qa": {
        "status": "draft",
        "generated_batch": "TL-NAR-GAIDEN-AUTO",
        "reviewed_by": "manual-translation-NAR-GAIDEN-BATCH-001"
      }
    },
    {
      "id": "EV-NAR-GAIDEN-0003",
      "title": "卡卡西外传·剧情节拍003",
      "aliases": [
        "Kakashi Gaiden"
      ],
      "continuity": "manga_canon",
      "arc_id": "ARC-NAR-GAIDEN",
      "parent_event_id": null,
      "when": {
        "scheduled_start": "K050-06-01",
        "scheduled_end": "K050-06-01",
        "time_of_day": "noon",
        "day_order": 600030,
        "basis": "allocated",
        "source_precision": "sequence_only",
        "canon_window": {
          "earliest": "K050-06-01",
          "latest": "K050-06-05"
        },
        "confidence": "low",
        "anchor_event_ids": [
          "EV-NAR-GAIDEN-0002"
        ],
        "rationale": "依据NARUTO漫画第239-244章篇章顺序，在项目窗口内均匀分配；具体日不是原著明示。"
      },
      "summary": "带土吹嘘说，一旦他觉醒了宇智波一族的血继限界写轮眼，他终将超越卡卡西。",
      "facts": [
        "带土吹嘘说，一旦他觉醒了宇智波一族的血继限界写轮眼，他终将超越卡卡西。"
      ],
      "participants": [],
      "location_ids": [],
      "depends_on": [
        "EV-NAR-GAIDEN-0002"
      ],
      "applicability": {
        "required": [],
        "blockers": [],
        "ai_instruction": "根据当前存档裁定发生、改写、跳过或延期。"
      },
      "canonical_outcomes": [],
      "knowledge": {
        "public_at_time": [],
        "restricted_at_time": [],
        "hidden_truth": []
      },
      "retrieval": {
        "keys": [
          "卡卡西外传",
          "Kakashi Gaiden"
        ],
        "tags": [
          "manga_canon",
          "nar-gaiden",
          "zh-reviewed"
        ],
        "spoiler_level": 2
      },
      "source_refs": [
        {
          "type": "manga",
          "work": "NARUTO",
          "chapter_start": 239,
          "chapter_end": 244,
          "pages": null,
          "supports": [
            "sequence",
            "summary"
          ],
          "note": "资料定位页：https://naruto.fandom.com/wiki/Kakashi_Gaiden"
        }
      ],
      "qa": {
        "status": "draft",
        "generated_batch": "TL-NAR-GAIDEN-AUTO",
        "reviewed_by": "manual-translation-NAR-GAIDEN-BATCH-001"
      }
    },
    {
      "id": "EV-NAR-GAIDEN-0004",
      "title": "卡卡西外传·剧情节拍004",
      "aliases": [
        "Kakashi Gaiden"
      ],
      "continuity": "manga_canon",
      "arc_id": "ARC-NAR-GAIDEN",
      "parent_event_id": null,
      "when": {
        "scheduled_start": "K050-06-01",
        "scheduled_end": "K050-06-01",
        "time_of_day": "afternoon",
        "day_order": 600040,
        "basis": "allocated",
        "source_precision": "sequence_only",
        "canon_window": {
          "earliest": "K050-06-01",
          "latest": "K050-06-05"
        },
        "confidence": "low",
        "anchor_event_ids": [
          "EV-NAR-GAIDEN-0003"
        ],
        "rationale": "依据NARUTO漫画第239-244章篇章顺序，在项目窗口内均匀分配；具体日不是原著明示。"
      },
      "summary": "水门告诉小队他们的任务：必须在岩隐村与木叶隐村交战之际穿越草隐村，摧毁一座桥梁以切断敌方的补给线。",
      "facts": [
        "水门告诉小队他们的任务：必须在岩隐村与木叶隐村交战之际穿越草隐村，摧毁一座桥梁以切断敌方的补给线。"
      ],
      "participants": [],
      "location_ids": [],
      "depends_on": [
        "EV-NAR-GAIDEN-0003"
      ],
      "applicability": {
        "required": [],
        "blockers": [],
        "ai_instruction": "根据当前存档裁定发生、改写、跳过或延期。"
      },
      "canonical_outcomes": [],
      "knowledge": {
        "public_at_time": [],
        "restricted_at_time": [],
        "hidden_truth": []
      },
      "retrieval": {
        "keys": [
          "卡卡西外传",
          "Kakashi Gaiden"
        ],
        "tags": [
          "manga_canon",
          "nar-gaiden",
          "zh-reviewed"
        ],
        "spoiler_level": 2
      },
      "source_refs": [
        {
          "type": "manga",
          "work": "NARUTO",
          "chapter_start": 239,
          "chapter_end": 244,
          "pages": null,
          "supports": [
            "sequence",
            "summary"
          ],
          "note": "资料定位页：https://naruto.fandom.com/wiki/Kakashi_Gaiden"
        }
      ],
      "qa": {
        "status": "draft",
        "generated_batch": "TL-NAR-GAIDEN-AUTO",
        "reviewed_by": "manual-translation-NAR-GAIDEN-BATCH-001"
      }
    },
    {
      "id": "EV-NAR-GAIDEN-0005",
      "title": "卡卡西外传·剧情节拍005",
      "aliases": [
        "Kakashi Gaiden"
      ],
      "continuity": "manga_canon",
      "arc_id": "ARC-NAR-GAIDEN",
      "parent_event_id": null,
      "when": {
        "scheduled_start": "K050-06-01",
        "scheduled_end": "K050-06-01",
        "time_of_day": "evening",
        "day_order": 600050,
        "basis": "allocated",
        "source_precision": "sequence_only",
        "canon_window": {
          "earliest": "K050-06-01",
          "latest": "K050-06-05"
        },
        "confidence": "low",
        "anchor_event_ids": [
          "EV-NAR-GAIDEN-0004"
        ],
        "rationale": "依据NARUTO漫画第239-244章篇章顺序，在项目窗口内均匀分配；具体日不是原著明示。"
      },
      "summary": "途中，木叶忍者们注意到他们正被树上的岩隐忍者魔蛭监视。",
      "facts": [
        "途中，木叶忍者们注意到他们正被树上的岩隐忍者魔蛭监视。"
      ],
      "participants": [],
      "location_ids": [],
      "depends_on": [
        "EV-NAR-GAIDEN-0004"
      ],
      "applicability": {
        "required": [],
        "blockers": [],
        "ai_instruction": "根据当前存档裁定发生、改写、跳过或延期。"
      },
      "canonical_outcomes": [],
      "knowledge": {
        "public_at_time": [],
        "restricted_at_time": [],
        "hidden_truth": []
      },
      "retrieval": {